{
  "$schema": "https://json-schema.org/draft/2020-12/schema",
  "$id": "https://raw.githubusercontent.com/autohandai/code-extensions/main/schema/autohand.extension.schema.json",
  "title": "Autohand Code Extension Manifest",
  "description": "Autohand Code declarative and trusted-runtime extension package manifest, API version 1.",
  "type": "object",
  "additionalProperties": false,
  "required": [
    "schemaVersion",
    "extensionApi",
    "id",
    "name",
    "version",
    "description",
    "contributes"
  ],
  "properties": {
    "$schema": {
      "type": "string",
      "format": "uri",
      "maxLength": 500
    },
    "schemaVersion": {
      "const": 1
    },
    "extensionApi": {
      "const": 1
    },
    "id": {
      "type": "string",
      "minLength": 3,
      "maxLength": 100,
      "pattern": "^[a-z][a-z0-9]*(?:[.-][a-z0-9]+)+$"
    },
    "name": {
      "type": "string",
      "minLength": 1,
      "maxLength": 100
    },
    "version": {
      "type": "string",
      "pattern": "^(?:0|[1-9]\\d*)\\.(?:0|[1-9]\\d*)\\.(?:0|[1-9]\\d*)$"
    },
    "description": {
      "type": "string",
      "minLength": 1,
      "maxLength": 500
    },
    "license": {
      "type": "string",
      "minLength": 1,
      "maxLength": 100
    },
    "repository": {
      "type": "string",
      "format": "uri",
      "maxLength": 500
    },
    "contributes": {
      "type": "object",
      "additionalProperties": false,
      "properties": {
        "tools": {
          "$ref": "#/$defs/contributionPaths"
        },
        "agents": {
          "$ref": "#/$defs/contributionPaths"
        },
        "skills": {
          "$ref": "#/$defs/contributionPaths"
        },
        "runtime": {
          "$ref": "#/$defs/contributionPaths"
        }
      },
      "anyOf": [
        { "required": ["tools"] },
        { "required": ["agents"] },
        { "required": ["skills"] },
        { "required": ["runtime"] }
      ]
    }
  },
  "$defs": {
    "contributionPaths": {
      "type": "array",
      "minItems": 1,
      "maxItems": 100,
      "uniqueItems": true,
      "items": {
        "type": "string",
        "minLength": 1,
        "maxLength": 240,
        "pattern": "^(?!/)(?![A-Za-z]:)(?!.*\\\\)(?!.*(?:^|/)\\.\\.?(?:/|$))(?!.*//)[^\\u0000]+$"
      }
    }
  }
}
